{"$schema":"https://json-schema.org/draft/2020-12/schema","title":"Atlas AI ROI Calculator Input","type":"object","required":["scenario_id","segment","baseline_hours_per_month","estimated_hourly_cost_nok","expected_efficiency_gain_percent","implementation_cost_nok"],"properties":{"scenario_id":{"type":"string"},"segment":{"enum":["business_professional","student","consumer_private_user"]},"baseline_hours_per_month":{"type":"number"},"estimated_hourly_cost_nok":{"type":"number"},"expected_efficiency_gain_percent":{"type":"number"},"implementation_cost_nok":{"type":"number"},"vendor_cost_policy":{"type":"string"},"notes":{"type":"string"}}}
